{"$schema":"https://json-schema.org/draft/2020-12/schema","$id":"https://leanhome.app/schemas/exercise.json","title":"Exercise","description":"A single exercise entry in the LeanHome catalog.","type":"object","required":["id","name_en","name_vi","primary_muscles","secondary_muscles","required_equipment","contraindicated_joints","difficulty_level","video_url","fallback_thumbnail_url","common_mistakes","correct_form_cues"],"properties":{"id":{"type":"string","pattern":"^[a-z0-9_]+$","description":"Unique slug identifier (lowercase, underscore-separated)"},"name_en":{"type":"string","minLength":1,"maxLength":100},"name_vi":{"type":"string","minLength":1,"maxLength":100},"primary_muscles":{"type":"array","items":{"type":"string","enum":["CHEST_UPPER","CHEST_MID","CHEST_LOWER","LATS","TRAPEZIUS","RHOMBOIDS","REAR_DELTOID","FRONT_DELTOID","SIDE_DELTOID","BICEPS","TRICEPS","FOREARMS","ABS","OBLIQUES","LOWER_BACK","GLUTES","HAMSTRINGS","QUADRICEPS","CALVES","HIP_FLEXORS","ADDUCTORS","ABDUCTORS"]},"minItems":1},"secondary_muscles":{"type":"array","items":{"type":"string","enum":["CHEST_UPPER","CHEST_MID","CHEST_LOWER","LATS","TRAPEZIUS","RHOMBOIDS","REAR_DELTOID","FRONT_DELTOID","SIDE_DELTOID","BICEPS","TRICEPS","FOREARMS","ABS","OBLIQUES","LOWER_BACK","GLUTES","HAMSTRINGS","QUADRICEPS","CALVES","HIP_FLEXORS","ADDUCTORS","ABDUCTORS","CORE"]}},"required_equipment":{"type":"array","items":{"type":"string","enum":["BODYWEIGHT_ONLY","RESISTANCE_BANDS","DUMBBELLS","PULL_UP_BAR","KETTLEBELL","BARBELL","FULL_GYM"]},"minItems":1},"contraindicated_joints":{"type":"array","items":{"type":"string","enum":["NECK","SHOULDER","ELBOW","WRIST","LOWER_BACK","HIP","KNEE","ANKLE"]}},"difficulty_level":{"type":"string","enum":["BEGINNER","INTERMEDIATE","ADVANCED"]},"video_url":{"type":"string","format":"uri"},"fallback_thumbnail_url":{"type":"string","format":"uri"},"common_mistakes":{"type":"array","items":{"type":"string","minLength":5},"minItems":2},"correct_form_cues":{"type":"array","items":{"type":"string","minLength":5},"minItems":2}}}