[
  {
    "id": "push_up_standard",
    "name_en": "Push-Up",
    "name_vi": "Hít đất cơ bản",
    "primary_muscles": [
      "CHEST_MID",
      "CHEST_LOWER"
    ],
    "secondary_muscles": [
      "TRICEPS",
      "FRONT_DELTOID",
      "ABS"
    ],
    "required_equipment": [
      "BODYWEIGHT_ONLY"
    ],
    "contraindicated_joints": [
      "WRIST",
      "SHOULDER"
    ],
    "difficulty_level": "BEGINNER",
    "video_url": "https://cdn.leanhome.app/exercises/push_up_standard.mp4",
    "fallback_thumbnail_url": "https://cdn.leanhome.app/exercises/push_up_standard.svg",
    "common_mistakes": [
      "Võng lưng dưới do thiếu gồng core",
      "Khủy tay bẹt 90 độ so với thân gây chấn thương vai"
    ],
    "correct_form_cues": [
      "Khủy tay tạo góc 45 độ so với thân",
      "Siết mông và bụng tạo đường thẳng từ gót chân đến gáy"
    ]
  },
  {
    "id": "push_up_knee",
    "name_en": "Knee Push-Up",
    "name_vi": "Hít đất quỳ gối",
    "primary_muscles": [
      "CHEST_MID",
      "CHEST_LOWER"
    ],
    "secondary_muscles": [
      "TRICEPS",
      "FRONT_DELTOID",
      "ABS"
    ],
    "required_equipment": [
      "BODYWEIGHT_ONLY"
    ],
    "contraindicated_joints": [
      "WRIST"
    ],
    "difficulty_level": "BEGINNER",
    "video_url": "https://cdn.leanhome.app/exercises/push_up_knee.mp4",
    "fallback_thumbnail_url": "https://cdn.leanhome.app/exercises/push_up_knee.svg",
    "common_mistakes": [
      "Hông cao hơn vai",
      "Thả nhanh xuống không kiểm soát"
    ],
    "correct_form_cues": [
      "Giữ hông và vai trên cùng 1 đường thẳng",
      "Hạ xuống 2 giây, đẩy lên 1 giây"
    ]
  },
  {
    "id": "push_up_diamond",
    "name_en": "Diamond Push-Up",
    "name_vi": "Hít đất kim cương",
    "primary_muscles": [
      "TRICEPS",
      "CHEST_MID"
    ],
    "secondary_muscles": [
      "FRONT_DELTOID",
      "ABS"
    ],
    "required_equipment": [
      "BODYWEIGHT_ONLY"
    ],
    "contraindicated_joints": [
      "WRIST",
      "ELBOW",
      "SHOULDER"
    ],
    "difficulty_level": "ADVANCED",
    "video_url": "https://cdn.leanhome.app/exercises/push_up_diamond.mp4",
    "fallback_thumbnail_url": "https://cdn.leanhome.app/exercises/push_up_diamond.svg",
    "common_mistakes": [
      "Tay đặt quá cao hoặc quá thấp so với ngực",
      "Khủy tay mở rộng ra hai bên thay vì ép sát thân"
    ],
    "correct_form_cues": [
      "Tay tạo hình kim cương ngay dưới ngực",
      "Khủy tay ép sát thân khi hạ xuống"
    ]
  },
  {
    "id": "pull_up_standard",
    "name_en": "Pull-Up",
    "name_vi": "Hít xà cơ bản",
    "primary_muscles": [
      "LATS",
      "BICEPS"
    ],
    "secondary_muscles": [
      "TRAPEZIUS",
      "RHOMBOIDS",
      "REAR_DELTOID",
      "ABS"
    ],
    "required_equipment": [
      "PULL_UP_BAR"
    ],
    "contraindicated_joints": [
      "SHOULDER",
      "ELBOW",
      "WRIST"
    ],
    "difficulty_level": "ADVANCED",
    "video_url": "https://cdn.leanhome.app/exercises/pull_up_standard.mp4",
    "fallback_thumbnail_url": "https://cdn.leanhome.app/exercises/pull_up_standard.svg",
    "common_mistakes": [
      "Đung đưa cơ thể để lấy đà",
      "Gập vai trèo lên thay vì kéo bằng bả vai"
    ],
    "correct_form_cues": [
      "Khởi đầu tĩnh, không đung đưa",
      "Kéo khuỷu tay xuống phía hông, siết bả vai"
    ]
  },
  {
    "id": "squat_bodyweight",
    "name_en": "Bodyweight Squat",
    "name_vi": "Squats tự do",
    "primary_muscles": [
      "QUADRICEPS",
      "GLUTES"
    ],
    "secondary_muscles": [
      "HAMSTRINGS",
      "CALVES",
      "ABS"
    ],
    "required_equipment": [
      "BODYWEIGHT_ONLY"
    ],
    "contraindicated_joints": [
      "KNEE",
      "ANKLE"
    ],
    "difficulty_level": "BEGINNER",
    "video_url": "https://cdn.leanhome.app/exercises/squat_bodyweight.mp4",
    "fallback_thumbnail_url": "https://cdn.leanhome.app/exercises/squat_bodyweight.svg",
    "common_mistakes": [
      "Đầu gối chụp vào trong (valgus knee)",
      "Nâng gót chân khỏi sàn khi squat xuống sâu"
    ],
    "correct_form_cues": [
      "Đầu gối hướng theo mũi chân",
      "Gió lưng dưới, trọng tâm gót chân"
    ]
  },
  {
    "id": "squat_goblet",
    "name_en": "Goblet Squat",
    "name_vi": "Squat bục tạ đơn",
    "primary_muscles": [
      "QUADRICEPS",
      "GLUTES"
    ],
    "secondary_muscles": [
      "HAMSTRINGS",
      "CALVES",
      "ABS",
      "BICEPS"
    ],
    "required_equipment": [
      "DUMBBELLS"
    ],
    "contraindicated_joints": [
      "KNEE",
      "ANKLE",
      "WRIST"
    ],
    "difficulty_level": "INTERMEDIATE",
    "video_url": "https://cdn.leanhome.app/exercises/squat_goblet.mp4",
    "fallback_thumbnail_url": "https://cdn.leanhome.app/exercises/squat_goblet.svg",
    "common_mistakes": [
      "Tạ xa cơ thể gây nghiêng về phía trước",
      "Lưng tròn khi squat xuống sâu"
    ],
    "correct_form_cues": [
      "Giữ tạ sát ngực",
      "Lưng thẳng, hạ hông xuống dưới đầu gối"
    ]
  },
  {
    "id": "lunges_bodyweight",
    "name_en": "Lunges",
    "name_vi": "Chùng chân bước",
    "primary_muscles": [
      "QUADRICEPS",
      "GLUTES"
    ],
    "secondary_muscles": [
      "HAMSTRINGS",
      "CALVES",
      "ABS"
    ],
    "required_equipment": [
      "BODYWEIGHT_ONLY"
    ],
    "contraindicated_joints": [
      "KNEE",
      "ANKLE",
      "HIP"
    ],
    "difficulty_level": "BEGINNER",
    "video_url": "https://cdn.leanhome.app/exercises/lunges_bodyweight.mp4",
    "fallback_thumbnail_url": "https://cdn.leanhome.app/exercises/lunges_bodyweight.svg",
    "common_mistakes": [
      "Bước chân quá ngắn gây đè gối",
      "Đầu gối trước vượt quá mũi chân"
    ],
    "correct_form_cues": [
      "Bước chân đủ dài để gối trước vuông góc 90 độ",
      "Giọng thẳng thân trên, không ngả ra trước"
    ]
  },
  {
    "id": "lunges_reverse",
    "name_en": "Reverse Lunges",
    "name_vi": "Chùng chân lùi",
    "primary_muscles": [
      "QUADRICEPS",
      "GLUTES"
    ],
    "secondary_muscles": [
      "HAMSTRINGS",
      "CALVES",
      "ABS"
    ],
    "required_equipment": [
      "BODYWEIGHT_ONLY"
    ],
    "contraindicated_joints": [
      "KNEE",
      "ANKLE"
    ],
    "difficulty_level": "BEGINNER",
    "video_url": "https://cdn.leanhome.app/exercises/lunges_reverse.mp4",
    "fallback_thumbnail_url": "https://cdn.leanhome.app/exercises/lunges_reverse.svg",
    "common_mistakes": [
      "Chân sau gối chạm sàn mạnh",
      "Thân trên ngả ra phía trước"
    ],
    "correct_form_cues": [
      "Hạ chân sau nhẹ nhàng, gối sau không chạm sàn",
      "Giữ thẳng thân trên, siết core"
    ]
  },
  {
    "id": "glute_bridge",
    "name_en": "Glute Bridge",
    "name_vi": "Cầu mông",
    "primary_muscles": [
      "GLUTES",
      "HAMSTRINGS"
    ],
    "secondary_muscles": [
      "ABS",
      "LOWER_BACK"
    ],
    "required_equipment": [
      "BODYWEIGHT_ONLY"
    ],
    "contraindicated_joints": [],
    "difficulty_level": "BEGINNER",
    "video_url": "https://cdn.leanhome.app/exercises/glute_bridge.mp4",
    "fallback_thumbnail_url": "https://cdn.leanhome.app/exercises/glute_bridge.svg",
    "common_mistakes": [
      "Dùng lưng đẩy hông thay vì mông",
      "Hông không nâng đủ cao"
    ],
    "correct_form_cues": [
      "Nén mông đẩy hông lên đến thẳng với thân",
      "Siết bụng khi nâng hông, không võng lưng"
    ]
  },
  {
    "id": "plank_standard",
    "name_en": "Plank",
    "name_vi": "Tấm ván",
    "primary_muscles": [
      "ABS",
      "OBLIQUES"
    ],
    "secondary_muscles": [
      "LOWER_BACK",
      "FRONT_DELTOID",
      "GLUTES"
    ],
    "required_equipment": [
      "BODYWEIGHT_ONLY"
    ],
    "contraindicated_joints": [
      "WRIST",
      "SHOULDER"
    ],
    "difficulty_level": "BEGINNER",
    "video_url": "https://cdn.leanhome.app/exercises/plank_standard.mp4",
    "fallback_thumbnail_url": "https://cdn.leanhome.app/exercises/plank_standard.svg",
    "common_mistakes": [
      "Võng lưng dưới",
      "Đầu gập xuống hoặc ngửa lên"
    ],
    "correct_form_cues": [
      "Cố định thẳng từ gáy đến gót chân",
      "Mắt nhìn xuống sàn, cổ thẳng"
    ]
  },
  {
    "id": "plank_side",
    "name_en": "Side Plank",
    "name_vi": "Tấm ván nghiêng",
    "primary_muscles": [
      "OBLIQUES",
      "ABS"
    ],
    "secondary_muscles": [
      "SHOULDER",
      "GLUTES",
      "HIP_FLEXORS"
    ],
    "required_equipment": [
      "BODYWEIGHT_ONLY"
    ],
    "contraindicated_joints": [
      "WRIST",
      "SHOULDER",
      "ELBOW"
    ],
    "difficulty_level": "INTERMEDIATE",
    "video_url": "https://cdn.leanhome.app/exercises/plank_side.mp4",
    "fallback_thumbnail_url": "https://cdn.leanhome.app/exercises/plank_side.svg",
    "common_mistakes": [
      "Hông chùng xuống sàn",
      "Thân người không giữ thẳng một bên"
    ],
    "correct_form_cues": [
      "Nâng hông lên thẳng với thân",
      "Tay chống vuông góc với vai"
    ]
  },
  {
    "id": "db_row_bent_over",
    "name_en": "Bent-Over DB Row",
    "name_vi": "Kéo tạ đơn cúi người",
    "primary_muscles": [
      "LATS",
      "RHOMBOIDS",
      "TRAPEZIUS"
    ],
    "secondary_muscles": [
      "BICEPS",
      "REAR_DELTOID",
      "LOWER_BACK"
    ],
    "required_equipment": [
      "DUMBBELLS"
    ],
    "contraindicated_joints": [
      "LOWER_BACK",
      "SHOULDER",
      "ELBOW"
    ],
    "difficulty_level": "INTERMEDIATE",
    "video_url": "https://cdn.leanhome.app/exercises/db_row_bent_over.mp4",
    "fallback_thumbnail_url": "https://cdn.leanhome.app/exercises/db_row_bent_over.svg",
    "common_mistakes": [
      "Lưng tròn khi cúi người kéo",
      "Kéo bằng biceps thay vì lưng"
    ],
    "correct_form_cues": [
      "Giữ lưng thẳng khi cúi người 45 độ",
      "Kéo tạ về phía hông, siết bả vai lại"
    ]
  },
  {
    "id": "db_row_chest_supported",
    "name_en": "Chest-Supported DB Row",
    "name_vi": "Kéo tạ đơn chống ngực",
    "primary_muscles": [
      "LATS",
      "RHOMBOIDS",